<?xml version="1.0" encoding="UTF-8"?>
<!DOCTYPE BALLPARK SYSTEM "C:\Documents and Settings\mikevg\My Documents\Lingo Website\estimator\ballpark.dtd">
<BALLPARK>
	<LANGUAGES>
		<LANGUAGE NAME="Arabic">
			<WORDCOUNT>
				<NEWTEXT>
					<NUMUNIT>119</NUMUNIT>
					<COSTPERUNIT>0.19</COSTPERUNIT>
					<COST>22.61</COST>
					<MARKUP>40</MARKUP>
					<CALCSELL>0.316666</CALCSELL>
					<ACTSELLPER>0.32</ACTSELLPER>
					<ACTSELL>38.08</ACTSELL>
					<GM>41</GM>
				</NEWTEXT>
				<FUZZYMATCH>
					<NUMUNIT>0</NUMUNIT>
					<COSTPERUNIT>0.19</COSTPERUNIT>
					<COST>0</COST>
					<MARKUP>40</MARKUP>
					<CALCSELL/>
					<ACTSELLPER>0</ACTSELLPER>
					<ACTSELL>0</ACTSELL>
					<GM>0</GM>
				</FUZZYMATCH>
				<REPS>
					<NUMUNIT>4</NUMUNIT>
					<COSTPERUNIT>0.19</COSTPERUNIT>
					<COST>0.76</COST>
					<MARKUP>40</MARKUP>
					<CALCSELL>0.316666</CALCSELL>
					<ACTSELLPER>0.32</ACTSELLPER>
					<ACTSELL>1.28</ACTSELL>
					<GM>41</GM>
				</REPS>
			</WORDCOUNT>
			<DTP>
				<FORMATTING>
					<NUMUNIT>0.00</NUMUNIT>
					<COSTPERUNIT>27</COSTPERUNIT>
					<COST>0</COST>
					<MARKUP>40</MARKUP>
					<CALCSELL/>
					<ACTSELLPER>0</ACTSELLPER>
					<ACTSELL>0</ACTSELL>
					<GM>0</GM>
				</FORMATTING>
			</DTP>
			<ENGINEERING>
				<TMWORK>
					<NUMUNIT/>
					<COSTPERUNIT>33</COSTPERUNIT>
					<COST>0</COST>
					<MARKUP>40</MARKUP>
					<CALCSELL/>
					<ACTSELLPER>0</ACTSELLPER>
					<ACTSELL>0</ACTSELL>
					<GM>0</GM>
				</TMWORK>
				<ENG>
					<NUMUNIT/>
					<COSTPERUNIT>33</COSTPERUNIT>
					<COST>0</COST>
					<MARKUP>40</MARKUP>
					<CALCSELL/>
					<ACTSELLPER>0</ACTSELLPER>
					<ACTSELL>0</ACTSELL>
					<GM>0</GM>
				</ENG>
				<SCAPS>
					<NUMUNIT>0.00</NUMUNIT>
					<COSTPERUNIT>33</COSTPERUNIT>
					<COST>0</COST>
					<MARKUP>40</MARKUP>
					<CALCSELL/>
					<ACTSELLPER>0</ACTSELLPER>
					<ACTSELL>0</ACTSELL>
					<GM>0</GM>
				</SCAPS>
				<GRAPHICS>
					<NUMUNIT>0.00</NUMUNIT>
					<COSTPERUNIT>33</COSTPERUNIT>
					<COST>0</COST>
					<MARKUP>40</MARKUP>
					<CALCSELL/>
					<ACTSELLPER>0</ACTSELLPER>
					<ACTSELL>0</ACTSELL>
					<GM>0</GM>
				</GRAPHICS>
			</ENGINEERING>
			<QA>
				<QUALASR>
					<NUMUNIT>0.00</NUMUNIT>
					<COSTPERUNIT>25</COSTPERUNIT>
					<COST>0</COST>
					<MARKUP>40</MARKUP>
					<CALCSELL/>
					<ACTSELLPER>0</ACTSELLPER>
					<ACTSELL>0</ACTSELL>
					<GM>0</GM>
				</QUALASR>
			</QA>
			<ADDITIONAL>
				<ADD1>
					<COST>1</COST>
					<MARKUP>40</MARKUP>
					<ACTSELL>0</ACTSELL>
					<GM>0</GM>
				</ADD1>
				<ADD2>
					<COST>1</COST>
					<MARKUP>40</MARKUP>
					<ACTSELL>0</ACTSELL>
					<GM>0</GM>
				</ADD2>
				<ADD3>
					<COST>1</COST>
					<MARKUP>40</MARKUP>
					<ACTSELL>0</ACTSELL>
					<GM>0</GM>
				</ADD3>
			</ADDITIONAL>
			<PM>
				<PROJMANG>
					<NUMUNIT/>
					<COSTPERUNIT>26</COSTPERUNIT>
					<COST>0</COST>
					<MARKUP/>
					<CALCSELL>0</CALCSELL>
					<ACTSELL>0</ACTSELL>
					<GM>0</GM>
				</PROJMANG>
			</PM>
			<TOTAL>
				<TOTALCOST>23.37</TOTALCOST>
				<CALCSELL>0.63</CALCSELL>
				<ACTSELL>39.36</ACTSELL>
				<GM>40.62</GM>
			</TOTAL>
		</LANGUAGE>
	</LANGUAGES>
	<HEADER>
		<DATE DATE="Nov 10, 2009"/>
		<REP REPRESENTATIVE="Ann Chay"/>
		<CLIENT NAME="Juniper"/>
		<PROJECT>
			<NAME NAME=""/>
			<PROJTYPE TYPE="Website"/>
			<FILETYPE TYPE="Word"/>
			<DELIVERABLE TYPE=""/>
			<SRCLANG TYPE="English (US)"/>
			<STARTDATE DATE=""/>
			<RUSHFEE>rf0</RUSHFEE>
			<NOTES/>
		</PROJECT>
	</HEADER>
</BALLPARK>
